{
  "period": {
    "start": "2026-05-01",
    "end": "2026-08-31"
  },
  "verification_source": "era5",
  "reference_forecast": "climatology_base_rate",
  "base_rate": 0.231,
  "skill_series": [
    {
      "lead_time_days": 1,
      "bs": 0.118,
      "bs_ref": 0.231,
      "bss": 0.489,
      "n_cases": 96
    },
    {
      "lead_time_days": 5,
      "bs": 0.201,
      "bs_ref": 0.231,
      "bss": 0.13,
      "n_cases": 96
    },
    {
      "lead_time_days": 9,
      "bs": 0.246,
      "bs_ref": 0.231,
      "bss": -0.065,
      "n_cases": 72
    }
  ],
  "reliability_bins": [
    {
      "p_center": 0.15,
      "observed_freq": 0.11,
      "n": 31
    },
    {
      "p_center": 0.45,
      "observed_freq": 0.39,
      "n": 28
    },
    {
      "p_center": 0.75,
      "observed_freq": 0.81,
      "n": 22
    }
  ],
  "roc_points": [
    {
      "threshold": 0.2,
      "pod": 0.94,
      "far": 0.51
    },
    {
      "threshold": 0.5,
      "pod": 0.78,
      "far": 0.28
    },
    {
      "threshold": 0.8,
      "pod": 0.41,
      "far": 0.11
    }
  ],
  "skill_horizon_measured_days": 8.0,
  "constants_block": {
    "J2": 0.00108262668,
    "GM": 398600441800000.0,
    "R_e": 6378137.0,
    "omega_sid_rad_s": 7.292115e-05,
    "gmst_model": "IAU_1982",
    "citation_id": "run_20261003_7f3a91c2",
    "source": {
      "J2": "spec II.10 constants table"
    }
  }
}
